<?xml version="1.0" encoding="UTF-8"?>

<controllers  xmlns:xsi='http://www.w3.org/2001/XMLSchema-instance'
   xmlns='http://www.brutosframework.com.br/schema/controllers'
   xsi:schemaLocation='http://www.brutosframework.com.br/schema/controllers http://www.brutosframework.com.br/schema/controllers/brutos-controllers-1.1.xsd'>

    <controller
        class="org.brandao.brutos.helper.controller.SimpleController">

        <bean name="bean"
            target="java.util.LinkedList">
                <element>
                <bean factory="factory"
                    method-factory="getInstance"
                    target="org.brandao.brutos.helper.controller.SimpleBean">
                        <constructor-arg type="java.lang.String">
                            <ref bean="arg"/>
                        </constructor-arg>
                </bean>
                </element>
        </bean>

        <bean name="factory"
            target="org.brandao.brutos.helper.controller.FactoryBean"/>

    </controller>

</controllers>
