<?xml version="1.0" encoding="windows-1252"?>
<controllers  xmlns:xsi='http://www.w3.org/2001/XMLSchema-instance'
              xmlns='http://www.brutosframework.com.br/schema/controllers'
              xmlns:context='http://www.brutosframework.com.br/schema/context'
              xsi:schemaLocation='
   http://www.brutosframework.com.br/schema/controllers http://www.brutosframework.com.br/schema/controllers/brutos-controllers-1.1.xsd
   http://www.brutosframework.com.br/schema/context http://www.brutosframework.com.br/schema/context/brutos-context-1.1.xsd'>

    <context:types>
        <context:type factory="org.brandao.webchat.controller.type.RoomServiceTypeFactory"/>
        <context:type factory="org.brandao.webchat.controller.type.SerializableObjectTypeFactory"/>
    </context:types>
    
    <interceptors>
        <interceptor name="checkUserInterceptor"
                     class="org.brandao.webchat.controller.interceptor.CheckUserInterceptor"/>
    </interceptors>
    
    <controller id="/Room/{roomID:\d+}" view="/layout/login.jsp" class="org.brandao.webchat.controller.RoomController">
        <interceptor-ref name="checkUserInterceptor"/>
        <property property-name="roomService" bean="roomID"/>
        <property property-name="currentUser" bean="sessionUser" scope="session"/>
        <action id="/login" view="/layout/login.jsp"/>
        <action id="/messagePart" view="/layout/messages.jsp"/>
        <action id="/sendPart" view="/layout/send.jsp"/>
        <action id="/send" executor="sendMessage">
            <parameter>
                <bean target="org.brandao.webchat.controller.entity.MessageDTO">
                    <property name="origin">
                        <bean target="org.brandao.webchat.controller.entity.UserDTO">
                            <property name="nick" bean="nick">
                                <validator message="userError">
                                    <rule name="maxlength" value="30"/>
                                    <rule name="matches" value="[^\&lt;\&gt;\s]*"/>
                                </validator>
                            </property>
                        </bean>
                    </property>
                    <property name="dest">
                        <bean target="org.brandao.webchat.controller.entity.UserDTO">
                            <property name="nick" bean="nick">
                                <validator message="userError">
                                    <rule name="maxlength" value="30"/>
                                    <rule name="matches" value="[^\&lt;\&gt;\s]*"/>
                                </validator>
                            </property>
                        </bean>
                    </property>
                    <property name="message" bean="message">
                        <validator message="msgError">
                            <rule name="maxlength" value="200"/>
                            <rule name="matches" value="[^\&lt;\&gt;]*"/>
                        </validator>
                    </property>
                </bean>
            </parameter>
        </action>
        <action id="/enter" executor="putUser" view="/layout/room.jsp">
            <parameter>
                <bean target="org.brandao.webchat.controller.entity.UserDTO">
                    <property name="nick" bean="nick">
                        <validator message="msgError">
                            <rule name="minlength" value="3"/>
                            <rule name="maxlength" value="30"/>
                            <rule name="matches" value="[^\&lt;\&gt;\s]*"/>
                        </validator>
                    </property>
                </bean>
            </parameter>
            <throw-safe view="/layout/login.jsp" name="exception" 
                        target="org.brandao.brutos.validator.ValidatorException"/>
            <throw-safe view="/layout/login.jsp" name="exception" 
                        target="org.brandao.webchat.model.UserExistException"/>
            <throw-safe view="/layout/login.jsp" name="exception" 
                        target="org.brandao.webchat.model.MaxUsersException"/>
            <throw-safe view="/layout/login.jsp" name="exception" 
                        target="java.lang.NullPointerException"/>
        </action>
        <action id="/exit" executor="removeUser">
            <parameter bean="user" scope="session"/>
        </action>
        <action id="/message" executor="getMessage" result-rendered="true"/>
        <action id="/listUsers" executor="getUsers" result-rendered="true"/>
    </controller>
</controllers>
