<?xml version="1.0" encoding="UTF-8"?>

<!--
  Brutos Web MVC http://www.brutosframework.com.br/
  Copyright (C) 2009 Afonso Brandão. (afonso.rbn@gmail.com)
-->

<controllers  xmlns:xsi='http://www.w3.org/2001/XMLSchema-instance'
              xmlns='http://www.brutosframework.com.br/schema/controllers'
              xmlns:context='http://www.brutosframework.com.br/schema/context'
              xsi:schemaLocation='
   http://www.brutosframework.com.br/schema/controllers http://www.brutosframework.com.br/schema/controllers/brutos-controllers-1.1.xsd
   http://www.brutosframework.com.br/schema/context http://www.brutosframework.com.br/schema/context/brutos-context-1.1.xsd'>


    <interceptors>
        <interceptor name="testInterceptor"
                    class="br.brandao.interceptors.TestInterceptor"/>
    </interceptors>

    <controller id="/index.jbrs" view="/WEB-INF/jsp/index.jsp"
               class="br.brandao.controller.IndexController" action-type="parameter">
       <!-- todos os métodos são interceptados exceto o método4() -->
        <interceptor-ref name="testInterceptor">
            <param name="excludeMethods">method4</param>
        </interceptor-ref>

        <action id="method1" executor="method1"/>
        <action id="method2" executor="method2"/>
        <action id="method3" executor="method3"/>
        <action id="method4" executor="method4"/>

    </controller>

</controllers>
