<?xml version="1.0" encoding="UTF-8"?>

<controllers  xmlns:xsi='http://www.w3.org/2001/XMLSchema-instance'
   xmlns='http://www.brutosframework.com.br/schema/controllers'
   xsi:schemaLocation='http://www.brutosframework.com.br/schema/controllers http://www.brutosframework.com.br/schema/controllers/brutos-controllers-1.1.xsd'>

    <controller
        class="org.brandao.brutos.helper.controller.SimpleController">

        <bean name="bean"
            target="java.util.LinkedList">
                <element>
                <bean
                    index-format="($index)"
                    target="org.brandao.brutos.helper.controller.SimpleBean">
                    <constructor-arg bean="str" type="java.lang.String">
                        <validator message="str is required">
                            <rule name="required"/>
                        </validator>
                    </constructor-arg>
                    <constructor-arg bean="arg" type="int">
                        <validator message="id is required">
                            <rule name="required"/>
                        </validator>
                    </constructor-arg>
                </bean>
                </element>
        </bean>

    </controller>

</controllers>
