<?xml version="1.0" encoding="UTF-8"?>

<controllers  xmlns:xsi='http://www.w3.org/2001/XMLSchema-instance'
   xmlns='http://www.brutosframework.com.br/schema/controllers'
   xsi:schemaLocation='http://www.brutosframework.com.br/schema/controllers http://www.brutosframework.com.br/schema/controllers/brutos-controllers-1.1.xsd'>

    <controller
        class="org.brandao.brutos.helper.controller.SimpleController">

        <bean name="bean"
            target="org.brandao.brutos.helper.controller.SimpleBean">
                <property name="date">
                    <ref bean="bean2" mapping="true"/>
                </property>
        </bean>

        <bean name="bean2"
            target="java.util.Date" factory="factoryDate" method-factory="parse">
                <constructor-arg type="java.lang.String">
                    <value>29/08/1984</value>
                </constructor-arg>
        </bean>

        <bean name="factoryDate"
            target="java.text.SimpleDateFormat">
                <constructor-arg type="java.lang.String">
                    <value>dd/MM/yyyy</value>
                </constructor-arg>
        </bean>

    </controller>

</controllers>
