<?xml version="1.0" encoding="UTF-8"?>

<controllers  xmlns:xsi='http://www.w3.org/2001/XMLSchema-instance'
   xmlns='http://www.brutosframework.com.br/schema/controllers'
   xsi:schemaLocation='http://www.brutosframework.com.br/schema/controllers http://www.brutosframework.com.br/schema/controllers/brutos-controllers-1.1.xsd'>

   <interceptors>
       <interceptor name="testInterceptor" 
                class="org.brandao.brutos.helper.controller.SimpleInterceptor">
                <param name="param1">value1</param>
                <param name="param2" value="value2"/>
       </interceptor>
       <interceptor-stack name="testStack">
           <interceptor-ref name="testInterceptor">
               <param name="param1">value3</param>
           </interceptor-ref>
       </interceptor-stack>
   </interceptors>
   
    <controller action-id="action" id="/testController.htm" action-type="parameter"
        class="org.brandao.brutos.helper.controller.SimpleController">

            <interceptor-ref name="testStack">
                <param name="testInterceptor.param1">value4</param>
            </interceptor-ref>
            
            <action id="defaultAction" result="result" executor="defaultAction"/>
    </controller>

</controllers>
